{
  "$schema": "https://json-schema.org/draft/2020-12/schema",
  "$id": "schedule.schema.json",
  "title": "Loop Schedule",
  "type": "object",
  "required": ["version", "loops"],
  "properties": {
    "version": { "type": "integer", "minimum": 1 },
    "timezone_default": { "type": "string" },
    "calendar_start": { "type": "string", "pattern": "^\\d{4}-\\d{2}-\\d{2}$" },
    "loops": {
      "type": "array",
      "minItems": 1,
      "items": {
        "type": "object",
        "required": ["name", "agent", "schedule", "timezone", "enabled"],
        "properties": {
          "name": { "type": "string", "pattern": "^[a-z][a-z0-9-]*$" },
          "title": { "type": "string", "minLength": 1 },
          "agent": { "enum": ["claude-cloud", "claude-laptop", "zai", "zai-sandbox", "zai-cloud"] },
          "schedule": { "type": "string", "minLength": 1 },
          "schedule_kind": { "enum": ["cron", "natural"] },
          "timezone": { "type": "string" },
          "enabled": { "type": "boolean" },
          "paused_until": { "type": ["string", "null"], "format": "date" },
          "writes_prs": { "type": "boolean" },
          "merges": { "type": "boolean" },
          "purpose": { "type": "string" },
          "details": {
            "description": "Long description of what the job does, shown in the calendar event. Lines separated by \\n.",
            "type": "string"
          },
          "prompt": { "type": "string", "pattern": "^prompts/[a-z0-9-]+\\.md$" },
          "trigger_id": { "type": ["string", "null"], "pattern": "^trig_[A-Za-z0-9]+$" },
          "dispatched": {
            "description": "Run by the kinz-dispatch routine when due, not by a routine of its own.",
            "type": "boolean"
          },
          "in_calendar": { "type": "boolean" },
          "calendar": {
            "description": "Calendar override for a gated loop that fires often but acts rarely.",
            "type": "object",
            "required": ["dtstart", "rrule"],
            "properties": {
              "dtstart": { "type": "string", "pattern": "^\\d{4}-\\d{2}-\\d{2}T\\d{2}:\\d{2}$" },
              "rrule": { "type": "string", "minLength": 1 },
              "note": { "type": "string" }
            }
          }
        }
      }
    }
  }
}
