{
  "version": 2,
  "timezone_default": "Africa/Tunis",
  "calendar_start": "2026-10-12",
  "loops": [
    {
      "name": "kinz-dispatch",
      "title": "KINZ · Night dispatcher",
      "agent": "claude-cloud",
      "schedule": "45 1,6 * * *",
      "schedule_kind": "cron",
      "timezone": "Africa/Tunis",
      "enabled": true,
      "paused_until": null,
      "writes_prs": false,
      "merges": false,
      "purpose": "The one claude.ai routine for all cloud jobs. Fires at 01:45 and 06:45, while Nassim sleeps, so loop work never uses up the KINZ account's daytime usage limit. Runs whichever jobs are due (scripts/due_jobs.py).",
      "prompt": "prompts/dispatch.md",
      "trigger_id": "trig_01RZePiYwx934QeB8rUvXGiP",
      "in_calendar": false
    },
    {
      "name": "kinz-upkeep",
      "title": "KINZ · Upkeep — CI, dependencies, merges",
      "agent": "claude-cloud",
      "schedule": "45 1 * * *",
      "schedule_kind": "cron",
      "timezone": "Africa/Tunis",
      "enabled": true,
      "paused_until": null,
      "writes_prs": true,
      "merges": true,
      "purpose": "Merge green dependency updates and green agent PRs, fix red CI, resolve conflicts, across all repos.",
      "prompt": "prompts/maintenance.md",
      "trigger_id": "trig_01RZePiYwx934QeB8rUvXGiP",
      "dispatched": true,
      "details": "Daily sweep of every Kinz-org repo in the registry (not the vault, not loop-engine-state).\n• Merges green Dependabot updates; asks Dependabot to rebase conflicted ones, closes them after two tries.\n• Takes over agent PRs (claude/loop-…): merges them when CI is green, resolves conflicts, fixes red CI (two attempts, then closes PRs older than 7 days).\n• Fixes a red default branch when the cause is clear; adds a pull-request CI workflow to a repo that has none.\n• Accounting repo: never merges a change to how a reported figure is derived — labels it 'hold' for you.\nMerge rules: CI ran and passed, no workflow file edited, no test weakened.\nOutput: merged PRs, a run record in runs/, one status line on your phone."
    },
    {
      "name": "kinz-market-watch",
      "title": "KINZ · Market watch — competitor data check",
      "agent": "claude-cloud",
      "schedule": "45 1 * * 2",
      "schedule_kind": "cron",
      "timezone": "Africa/Tunis",
      "enabled": true,
      "paused_until": null,
      "writes_prs": false,
      "merges": false,
      "purpose": "Read-only check of the weekly KINZ scrape data; runs the night after Monday's scrape. Writes findings only.",
      "prompt": "prompts/kinz-analyst.md",
      "trigger_id": "trig_01RZePiYwx934QeB8rUvXGiP",
      "dispatched": true,
      "details": "Read-only check of the weekly competitor scrape, the night after Monday's GitHub Actions run.\n• Downloads competitors.db from the 'weekly-scrape-data' release of kinz-competitor-intelligence.\n• Counts competitors, products and price history; finds competitors the scrape missed, suspicious prices (zeros, identical clusters), the 100-product pagination bug, and price moves over 30%.\n• Never prints contact names, phones or emails; deletes the database at the end.\nChanges nothing in the repo. Output: a new dated section in findings/kci-data-quality.md."
    },
    {
      "name": "kinz-polish",
      "title": "KINZ · Polish — improvements on two repos",
      "agent": "claude-cloud",
      "schedule": "45 1 * * 1,3,5",
      "schedule_kind": "cron",
      "timezone": "Africa/Tunis",
      "enabled": true,
      "paused_until": null,
      "writes_prs": true,
      "merges": true,
      "purpose": "Top improvement-list item on 2 repos by rotation; refill a repo's list when it runs low. Merges when green.",
      "prompt": "prompts/improvements.md",
      "trigger_id": "trig_01RZePiYwx934QeB8rUvXGiP",
      "dispatched": true,
      "details": "Monday, Wednesday and Friday: real improvements on the next two repos of the rotation.\n• Reads each repo's docs/IMPROVEMENTS.md and refills it to 3–5 items found in the code when it runs low.\n• Fixes the top open item on its own branch, with a regression test for every bug, and ticks it off in the same PR.\n• Merges when CI is green; money, tax and reported-figure logic goes to an Opus subagent with tests that pin the numbers.\nOutput: up to two merged PRs, rotation cursor moved, notes for future runs in registry.json."
    },
    {
      "name": "kinz-ledger",
      "title": "KINZ · Ledger — accounting repo fixes",
      "agent": "claude-cloud",
      "schedule": "45 1 * * 0,2,4",
      "schedule_kind": "cron",
      "timezone": "Africa/Tunis",
      "enabled": true,
      "paused_until": null,
      "writes_prs": true,
      "merges": true,
      "purpose": "Kinz accounting repo improvement pass: 1-3 well-tested fixes, merged when green. Figure-changing PRs wait for Nassim.",
      "trigger_id": "trig_01RZePiYwx934QeB8rUvXGiP",
      "dispatched": true,
      "prompt": "prompts/kinz-accounting.md",
      "details": "Sunday, Tuesday and Thursday: 1 to 3 tested fixes in kinz-accounting-analysis.\n• Runs pytest, ruff and the read-only verifier; rebuilds reports offline from the committed extract (never calls Odoo).\n• Looks for wrong maths, dead code paths, reports that contradict their data, stale docs, missing tests.\n• Tax and money reasoning goes to an Opus subagent. A change to a reported figure is left open with the 'hold' label and a NEEDS YOU alert.\nOutput: merged test/doc/fix PRs, held figure changes for you."
    },
    {
      "name": "kinz-lab",
      "title": "KINZ · Lab — weekly creative experiment",
      "agent": "claude-cloud",
      "schedule": "45 1 * * 6",
      "schedule_kind": "cron",
      "timezone": "Africa/Tunis",
      "enabled": true,
      "paused_until": null,
      "writes_prs": true,
      "merges": true,
      "purpose": "One new idea in one repo; a fresh Opus agent checks it against a goal written first. Merges if verified and green.",
      "prompt": "prompts/creative.md",
      "trigger_id": "trig_01RZePiYwx934QeB8rUvXGiP",
      "dispatched": true,
      "details": "Saturday: one new idea in one rotation repo, judged by an independent agent.\n• Picks a repo (not last week's), chooses an idea that fits one PR, and writes 3–6 success checks in experiments/ before writing code.\n• Builds it with tests, then a fresh Opus judge runs every check and answers VERIFIED or NOT VERIFIED.\n• Merged only if VERIFIED and CI is green; one retry with a new judge, otherwise closed with the verdict.\nOutput: the experiment file with its verdict, and the PR."
    },
    {
      "name": "kinz-heartbeat",
      "title": "KINZ · Heartbeat — one small fix if the day is empty",
      "agent": "claude-cloud",
      "schedule": "45 6 * * *",
      "schedule_kind": "cron",
      "timezone": "Africa/Tunis",
      "enabled": true,
      "paused_until": null,
      "writes_prs": true,
      "merges": true,
      "purpose": "Only if nothing landed today: one small, real fix, merged when green. Runs after the night jobs.",
      "prompt": "prompts/daily-commit.md",
      "trigger_id": "trig_01RZePiYwx934QeB8rUvXGiP",
      "dispatched": true,
      "details": "Every morning at 06:45, after the night jobs.\n• If anything already landed today on a Kinz-org repo, it stops (status: skipped).\n• Otherwise makes one small, real fix in the least recently updated rotation repo: an open improvement item, a wrong doc line, a missing test.\n• No whitespace churn, no renames for their own sake. Merged when CI is green.\nOutput: at most one merged PR, so the contribution graph shows real work every day."
    },
    {
      "name": "kinz-digest",
      "title": "KINZ · Monday digest — the week in one page",
      "agent": "claude-cloud",
      "schedule": "45 6 * * 1",
      "schedule_kind": "cron",
      "timezone": "Africa/Tunis",
      "enabled": true,
      "paused_until": null,
      "writes_prs": false,
      "merges": false,
      "purpose": "Weekly report on Monday morning: what merged, what failed, what never ran, what's next.",
      "prompt": "prompts/weekly-summary.md",
      "trigger_id": "trig_01RZePiYwx934QeB8rUvXGiP",
      "dispatched": true,
      "details": "Monday 06:45: the weekly report you read on your phone.\n• Shipped: merged PRs per repo, with links.\n• Broken or stuck: red CI, PRs left open, failures.\n• Jobs that did not run: compares each job's schedule with its run records; 'missing' means it never fired.\n• The Lab verdict, next week's rotation, and repos not attached to the routine (NEEDS YOU).\nChanges no work repo. Output: reports/weekly-<year>-W<week>.md."
    },
    {
      "name": "kinz-portfolio",
      "title": "KINZ · Portfolio review — three public repos",
      "agent": "claude-cloud",
      "schedule": "45 1 * * 0",
      "schedule_kind": "cron",
      "timezone": "Africa/Tunis",
      "enabled": true,
      "paused_until": null,
      "writes_prs": true,
      "merges": true,
      "purpose": "Weekly portfolio review of three public Kinz-org repos, with small checkable fixes merged and the rest reported.",
      "details": "Sunday 01:45: the github-portfolio-builder method, applied to the three public repos reviewed longest ago.\n• Reads each README and checks its claims against the code: links, badges, quick-start commands, license.\n• Labels every finding verified, reported or unresolved; at most five per repo.\n• Fixes and merges only small checkable things (wrong links, wrong badges, commands that don't match the code, README lines the code contradicts).\n• Licenses, visibility, descriptions, claims about results and workflows are left to you, listed under 'Needs the owner'.\nOutput: reports/portfolio-<year>-W<week>.md and the merged PRs.",
      "prompt": "prompts/portfolio.md",
      "trigger_id": "trig_01RZePiYwx934QeB8rUvXGiP",
      "dispatched": true
    },
    {
      "name": "kinz-vault",
      "title": "KINZ · Vault gardener — Obsidian weekly pass",
      "agent": "claude-cloud",